{
  "schema_id": "reasoning.platform.route-plan",
  "schema_version": "1.0.0-alpha.2",
  "route_plan_id": "route_plan_lhh",
  "operation_id": "operation_hybrid_matrix",
  "actor": {"type": "user", "id": "user_alice"},
  "tenant_id": "tenant_alpha",
  "persistence": {
    "location": "local",
    "project_bundle_id": "project_bundle_local_algebra_001",
    "project_id": "project_local_algebra",
    "project_revision_digest": "sha256:aaaaaaaaaaaaaaaaaaaaaaaaaaaaaaaaaaaaaaaaaaaaaaaaaaaaaaaaaaaaaaaa",
    "transfer_manifest_id": "transfer_hybrid_001"
  },
  "harness": {
    "harness_id": "codex",
    "descriptor_digest": "sha256:7cc42bd69c85910110b602aa6fa965e0488f93e267ce39cb05a4a4a6fef9e9f6",
    "location": "local"
  },
  "inference": {
    "route_id": "route_cloud_openrouter",
    "route_digest": "sha256:7cce9941428976587bfa02af9dfb285a78a0bd0c3770ad17774922147a8e0b5a",
    "provider": "provider_openrouter",
    "model": "openai/gpt-5.6",
    "reasoning_effort": "high",
    "location": "hosted"
  },
  "compute": {
    "target_id": "target_cloud_research_cpu",
    "target_digest": "sha256:08d7acb1ac2efeff532884e1ea09fd5e324313504af003c582902e7832980cb0",
    "location": "hosted",
    "executor_contract_version": "1.0.0-alpha.1",
    "image": {
      "repository": "registry.example.org/research-cpu",
      "digest": "sha256:4444444444444444444444444444444444444444444444444444444444444444",
      "capabilities_digest": "sha256:5555555555555555555555555555555555555555555555555555555555555555",
      "attestation_digest": "sha256:6666666666666666666666666666666666666666666666666666666666666666"
    },
    "connector_grant_id": "connector_grant_hybrid_001"
  },
  "decision": {"source": "user", "decided_at": "2026-09-01T18:03:00Z", "compatibility": "passed", "policy": "passed"},
  "pricing_lifecycle_id": "pricing_hybrid_001",
  "pricing_contract_version": "1.0.0-alpha.2"
}
